{
  "schema": "cdeadmin.ui-navigator.v1",
  "engine": "tidb",
  "sort": "alphabetical",
  "groups": [
    {
      "group_id": "topology",
      "title": "Topology",
      "kinds": [
        "cluster",
        "node"
      ],
      "order": 1
    },
    {
      "group_id": "namespaces",
      "title": "Databases and schemas",
      "kinds": [
        "database"
      ],
      "order": 2
    },
    {
      "group_id": "relations",
      "title": "Tables and views",
      "kinds": [
        "table",
        "column",
        "index",
        "constraint",
        "view",
        "sequence",
        "partition"
      ],
      "order": 3
    },
    {
      "group_id": "placement",
      "title": "Placement and resources",
      "kinds": [
        "placement-policy",
        "resource-group",
        "tiflash-replica"
      ],
      "order": 4
    },
    {
      "group_id": "replication",
      "title": "Replication",
      "kinds": [
        "changefeed"
      ],
      "order": 5
    },
    {
      "group_id": "security",
      "title": "Security",
      "kinds": [
        "user",
        "role",
        "privilege"
      ],
      "order": 6
    },
    {
      "group_id": "operations",
      "title": "Administration",
      "kinds": [
        "job",
        "backup"
      ],
      "order": 7
    }
  ],
  "resource_children": {
    "table": [
      "column",
      "index",
      "constraint",
      "partition"
    ],
    "view": [
      "column"
    ]
  },
  "kind_icons": {
    "cluster": "object.cluster",
    "node": "object.node",
    "database": "object.database",
    "table": "object.table",
    "column": "object.column",
    "index": "object.index",
    "constraint": "object.constraint",
    "view": "object.view",
    "sequence": "object.sequence",
    "partition": "object.partition",
    "placement-policy": "object.filespace",
    "resource-group": "object.pipeline",
    "tiflash-replica": "object.columnar_table",
    "job": "object.job",
    "changefeed": "object.replication",
    "backup": "object.snapshot",
    "user": "object.user",
    "role": "object.role",
    "privilege": "object.privilege"
  }
}
