{
  "schema": "cdeadmin.ui-navigator.v1",
  "engine": "yugabytedb",
  "sort": "alphabetical",
  "groups": [
    {
      "group_id": "topology",
      "title": "Topology",
      "kinds": [
        "universe",
        "cluster",
        "node",
        "region",
        "zone",
        "tserver",
        "master",
        "tablet",
        "placement-policy"
      ],
      "order": 1
    },
    {
      "group_id": "namespaces",
      "title": "Databases and schemas",
      "kinds": [
        "database",
        "schema",
        "tablespace",
        "extension"
      ],
      "order": 2
    },
    {
      "group_id": "relations",
      "title": "Tables and views",
      "kinds": [
        "table",
        "column",
        "index",
        "constraint",
        "partition",
        "view",
        "materialized-view",
        "sequence"
      ],
      "order": 3
    },
    {
      "group_id": "programmability",
      "title": "Types, routines and triggers",
      "kinds": [
        "type",
        "domain",
        "function",
        "procedure",
        "trigger"
      ],
      "order": 4
    },
    {
      "group_id": "replication",
      "title": "Replication",
      "kinds": [
        "changefeed",
        "xcluster-replication"
      ],
      "order": 5
    },
    {
      "group_id": "security",
      "title": "Security",
      "kinds": [
        "user",
        "role",
        "privilege",
        "row-policy"
      ],
      "order": 6
    },
    {
      "group_id": "operations",
      "title": "Backup and schedules",
      "kinds": [
        "snapshot",
        "schedule"
      ],
      "order": 7
    }
  ],
  "resource_children": {
    "table": [
      "column",
      "index",
      "constraint",
      "partition",
      "trigger",
      "row-policy"
    ],
    "view": [
      "column"
    ]
  },
  "kind_icons": {
    "universe": "object.cluster",
    "cluster": "object.cluster",
    "node": "object.node",
    "region": "object.node",
    "zone": "object.node",
    "tserver": "object.server",
    "master": "object.server",
    "tablet": "object.partition",
    "placement-policy": "object.filespace",
    "database": "object.database",
    "schema": "object.schema",
    "tablespace": "object.tablespace",
    "extension": "object.extension",
    "table": "object.table",
    "column": "object.column",
    "index": "object.index",
    "constraint": "object.constraint",
    "partition": "object.partition",
    "view": "object.view",
    "materialized-view": "object.materialized_view",
    "sequence": "object.sequence",
    "type": "object.type",
    "domain": "object.domain",
    "function": "object.function",
    "procedure": "object.procedure",
    "trigger": "object.trigger",
    "changefeed": "object.replication",
    "xcluster-replication": "object.replication",
    "user": "object.user",
    "role": "object.role",
    "privilege": "object.privilege",
    "snapshot": "object.snapshot",
    "schedule": "object.job",
    "row-policy": "object.privilege"
  }
}
